{
  "case_id": "mock_case_indeterminate",
  "created_at": "2026-06-19T00:00:00Z",
  "input_files": [],
  "series": [],
  "patient_metadata_redacted": true,
  "calibration_summary": {
    "pixel_spacing": false,
    "doppler_scale": false,
    "nyquist_velocity": false
  },
  "missing_information": [
    "No real study supplied",
    "Nyquist velocity",
    "validated CWD envelope"
  ],
  "file_hashes": {}
}
